{
  "slug": "onion-thrips",
  "version": 1,
  "status": "draft",
  "scientific_name": "Thrips tabaci",
  "names": {"en": "Onion thrips"},
  "aliases": ["Thrips tabaci", "tobacco thrips (contextual)"],
  "kingdom": "insecta",
  "affected_crop_slugs": ["big-onion", "leeks", "cabbage", "cauliflower", "knol-khol", "tomato", "capsicum"],
  "life_stages": ["egg", "nymph", "pupa", "adult"],
  "feeding_type": ["rasping", "sap_feeding"],
  "favored_conditions": {
    "humidity": "low",
    "temperature_c": {"min": 20, "max": 30, "unit": "°C"},
    "notes": {
      "en": "Dry, warm weather during onion/leek bulbing phase amplifies populations. Weed grasses and cereal volunteers are key alternate hosts."
    }
  },
  "description": {
    "en": "The primary thrips pest of Sri Lanka's onion (big onion) and leek up-country crops. Adults and nymphs rasp leaf surfaces producing silvery scarring that reduces photosynthesis; also transmits iris yellow spot virus (IYSV). Damage aligns with bulb initiation — significant yield impact. **Management**: (a) **spinosad + neem oil combination spray** — DOA-cited IPM protocol; reduces populations and increases yields; (b) **flower-strip habitat manipulation** — reduced thrips 50% with 25% yield uplift in research trials; (c) yellow/blue sticky traps at canopy height; (d) avoid over-N fertilisation; (e) in polytunnels, Amblyseius predatory mites; (f) resistant cultivars where trialed ('Rossa di Milano' outperforms 'Bradley')."
  },
  "field_provenance": {
    "description": {"source_id": "pmc_onion_thrips_ipm", "source_url": "https://pmc.ncbi.nlm.nih.gov/articles/PMC8000123/", "fetched_at": "2026-04-17T00:00:00Z", "quote": "Onion thrips (Thrips tabaci) is a well-known onion pest worldwide that causes both direct and indirect damage to onion by feeding and ovipositing on leaves. Onions sprayed with spinosad + neem oil had fewer T. tabaci and produced higher yields than onions that were unsprayed. Habitat manipulation techniques, particularly the use of flower strips, reduced thrips populations by up to 50% and increased onion yields by 25%. The cultivar Rossa di Milano had relatively fewer adult and larval thrips populations compared with Bradley."}
  }
}
